{
  "form_info": {
    "form_number": "ACORD 101",
    "form_edition": "2008/01",
    "form_title": "ADDITIONAL REMARKS SCHEDULE"
  },
  "header": {
    "insured_name": "Keystone Commercial Builders, Inc.",
    "insured_address": "300 Liberty Avenue, Suite 1200",
    "insured_city": "Pittsburgh",
    "insured_state": "PA",
    "insured_zip": "15222",
    "carrier_name": "Hallmark Insurance Group",
    "policy_number": "WC-KCB-2025-5581",
    "effective_date": "2025-08-01",
    "expiration_date": null,
    "producer_name": "Steel City Insurance Group",
    "producer_code": null
  },
  "applicant_info": {
    "fein": null,
    "sic_code": null,
    "naics_code": null,
    "years_in_business": null,
    "nature_of_business": "General contracting for commercial and institutional construction, including healthcare facilities, educational buildings, and corporate offices.",
    "entity_type": "Corporation"
  },
  "additional_remarks": [
    {
      "section_reference": "ENDORSEMENT SCHEDULE",
      "remark": "Includes listed endorsements such as Amendment of Aggregate Limits of Insurance - Per Project, Designated Construction Project(s) General Aggregate Limit, Waiver of Transfer of Rights of Recovery Against Others to Us, and Alternate Employer Endorsement."
    },
    {
      "section_reference": "ADDITIONAL INSURED",
      "remark": "Additional insured status is extended to Woodbridge Realty Management Inc. as required by written contract. Coverage is primary and noncontributory."
    },
    {
      "section_reference": "SPECIAL CONDITIONS",
      "remark": "Primary and Non-Contributory wording option per policy endorsement."
    },
    {
      "section_reference": "LOCATION DESCRIPTIONS",
      "remark": "LOC-001: Corporate Headquarters - 300 Liberty Avenue, Suite 1200, Pittsburgh, PA 15222 (Occupancy: Office). LOC-002: Main Equipment Yard & Warehouse - 4500 Butler Street, Pittsburgh, PA 15201 (Occupancy: Warehouse). LOC-003: Fabrication Shop - 4720 Butler Street, Pittsburgh, PA 15201 (Occupancy: Manufacturing). LOC-004: South Hills Branch Office - 300 Village Run Road, Wexford, PA 15090 (Occupancy: Office)."
    },
    {
      "section_reference": "SUBCONTRACTOR REQUIREMENTS",
      "remark": "Evidence of Workers Compensation coverage is required from all subcontractors prior to commencing work on the project."
    },
    {
      "section_reference": "NATURE OF OPERATIONS",
      "remark": "The insured's principal operations consist of general contracting for commercial and institutional construction, including healthcare facilities, educational buildings, and corporate offices throughout Western Pennsylvania. Entity type: Corporation."
    }
  ],
  "checkboxes": [],
  "remarks": null
}