{
  "additional_remarks": [
    {
      "remark": "Attached to Form Number: ACORD 126; Form Title: Commercial General Liability Section.",
      "section_reference": "Form Attachment"
    },
    {
      "remark": "1. IL 09 85 01 15 \u2014 Disclosure Pursuant to Terrorism Risk Insurance Act\n2. CG 20 26 04 13 \u2014 Additional Insured - Designated Person or Organization\n3. WC 00 03 13 \u2014 Waiver of Our Right to Recover From Others Endorsement\n4. CG 24 04 05 09 \u2014 Waiver of Transfer of Rights of Recovery Against Others to Us\n5. IM 99 01 08 06 \u2014 Inland Marine Equipment Floater\n6. CP 10 30 06 07 \u2014 Causes of Loss - Special Form",
      "section_reference": "ENDORSEMENT SCHEDULE"
    },
    {
      "remark": "Oakstone Realty Management Inc. is included as additional insured per written contract, agreement, or permit as respects General Liability.",
      "section_reference": "ADDITIONAL INSURED"
    },
    {
      "remark": "Primary and Non-Contributory wording applies per policy endorsement. Per Project Aggregate Limit applies as indicated on the endorsement schedule.",
      "section_reference": "SPECIAL CONDITIONS"
    },
    {
      "remark": "LOC-001: Corporate Headquarters & Main Terminal \u2014 1200 Nationwide Boulevard, Columbus, OH 43215 (Occupancy: Warehouse)\nLOC-002: Rickenbacker Air Hub \u2014 2500 Norton Road, Columbus, OH 43217 (Occupancy: Warehouse)\nLOC-003: Cleveland Distribution Center \u2014 6000 Rockside Woods Boulevard, Independence, OH 44131 (Occupancy: Warehouse)\nLOC-004: Pittsburgh Regional Terminal \u2014 500 Technology Drive, Canonsburg, PA 15317 (Occupancy: Warehouse)",
      "section_reference": "LOCATION DESCRIPTIONS"
    },
    {
      "remark": "The insured's principal operations consist of: Regional trucking and freight logistics \u2014 LTL and FTL general freight, warehousing and distribution services across the Midwest and Mid-Atlantic corridors. Entity type: Corporation.",
      "section_reference": "NATURE OF OPERATIONS"
    }
  ],
  "applicant_info": {
    "entity_type": "Corporation",
    "fein": null,
    "naics_code": null,
    "nature_of_business": "Regional trucking and freight logistics \u2014 LTL and FTL general freight, warehousing and distribution services across the Midwest and Mid-Atlantic corridors.",
    "sic_code": null,
    "years_in_business": null
  },
  "checkboxes": [],
  "form_info": {
    "form_edition": "2008/01",
    "form_number": "ACORD 101",
    "form_title": "Additional Remarks Schedule"
  },
  "header": {
    "carrier_name": "Standard Insurance Company",
    "effective_date": "2025-07-01",
    "expiration_date": null,
    "insured_address": "1200 Nationwide Blvd.",
    "insured_city": "Columbus",
    "insured_name": "Great Lakes Freight Systems, Incorporated",
    "insured_state": "OH",
    "insured_zip": "43215",
    "policy_number": "GL-2415-2025-8821",
    "producer_code": null,
    "producer_name": "Transportation Insurance Specialists"
  },
  "remarks": "Attached to Form Number: ACORD 126; Form Title: Commercial General Liability Section.\n\nENDORSEMENT SCHEDULE:\n1. IL 09 85 01 15 \u2014 Disclosure Pursuant to Terrorism Risk Insurance Act\n2. CG 20 26 04 13 \u2014 Additional Insured - Designated Person or Organization\n3. WC 00 03 13 \u2014 Waiver of Our Right to Recover From Others Endorsement\n4. CG 24 04 05 09 \u2014 Waiver of Transfer of Rights of Recovery Against Others to Us\n5. IM 99 01 08 06 \u2014 Inland Marine Equipment Floater\n6. CP 10 30 06 07 \u2014 Causes of Loss - Special Form\n\nADDITIONAL INSURED:\nOakstone Realty Management Inc. is included as additional insured per written contract, agreement, or permit as respects General Liability.\n\nSPECIAL CONDITIONS:\nPrimary and Non-Contributory wording applies per policy endorsement. Per Project Aggregate Limit applies as indicated on the endorsement schedule.\n\nLOCATION DESCRIPTIONS:\nLOC-001: Corporate Headquarters & Main Terminal \u2014 1200 Nationwide Boulevard, Columbus, OH 43215 (Occupancy: Warehouse)\nLOC-002: Rickenbacker Air Hub \u2014 2500 Norton Road, Columbus, OH 43217 (Occupancy: Warehouse)\nLOC-003: Cleveland Distribution Center \u2014 6000 Rockside Woods Boulevard, Independence, OH 44131 (Occupancy: Warehouse)\nLOC-004: Pittsburgh Regional Terminal \u2014 500 Technology Drive, Canonsburg, PA 15317 (Occupancy: Warehouse)\n\nNATURE OF OPERATIONS:\nThe insured's principal operations consist of: Regional trucking and freight logistics \u2014 LTL and FTL general freight, warehousing and distribution services across the Midwest and Mid-Atlantic corridors. Entity type: Corporation."
}